key,de,en,es,es_MX,fr,it,ja,ko,pl,pt_BR,tr,zh_TW
UNLOCK_EXTENDED_CONTENT,,"I have played the first chapter in the demo version. 
Please, unlock the second chapter.",,,,,,,,,,
REPORT_ISSUE,,Report an issue,,,,,,,,,,
PLAY_FIRST_GAME,,Play the Case of the Golden Idol,,,,,,,,,,
<!MissingKey:Congratulations! You have deduced your way through the first scenario of Chapter 2 of The Rise of the Golden Idol. Please treat your intellect to a well-deserved rest. >,,"Congratulations! You have deduced your way through the first scenario of Chapter 2 of The Rise of the Golden Idol. Please treat your intellect to a well-deserved rest. 

The Rise of the Golden Idol will release worldwide, with 20 scenarios to uncover and untangle on November 12, 2024. 
Wishlist the game to prepare for what’s coming next. Be ready for anything!
—Team Idol",,,,,,,,,,
UNLOCK_EXTENDED_CONTENT_BTN,,Unlock the extended content now,,,,,,,,,,
"<!MissingKey:No, I will refresh my experience by replaying it>",,"No, I will refresh my experience by replaying it",,,,,,,,,,
EXTENDED DEMO TITLE,,The Rise of the [b]Golden Idol[/b] extended demo,,,,,,,,,,
UNLOCK_BTN,,Unlock,,,,,,,,,,
